{
  "prompt": "Complete the sentence.",
  "template": "On {{down}}, the offense must gain {{yards}} yards for a new set of downs.",
  "gaps": [
    {
      "id": "down",
      "options": [
        "first",
        "fourth"
      ],
      "correct": "fourth"
    },
    {
      "id": "yards",
      "options": [
        "5",
        "10"
      ],
      "correct": "10"
    }
  ],
  "explanation": {
    "correct": "That is why fourth down is such a big decision.",
    "incorrect": "The offense always needs 10 yards total; fourth is the last try."
  }
}
